id,nombre_completo,carrera,puntaje,vacante,observacion,segunda_opcion
268279,"CHOQUE URBANO, JEAN FRANCISCO",INGENIERÍA GEOLÓGICA - OYÓN,521.2500,,,
299586,"DAMAZO CARDENAS, MAREORY PENÉLOPE",INGENIERÍA GEOLÓGICA - OYÓN,546.2500,,,
235340,"DE LA CRUZ PANDAL, STOWARD MAICKY",INGENIERÍA GEOLÓGICA - OYÓN,328.2500,,,
256939,"FERNANDEZ BUSTAMANTE, ELENA EVA",INGENIERÍA GEOLÓGICA - OYÓN,511.3750,,,
267989,"RAMOS CANCHARI, MARIO HANSEL JHEREMY",INGENIERÍA GEOLÓGICA - OYÓN,437.8750,,,
255925,"RAMOS ROMAN, ALEJANDRO RAUL",INGENIERÍA GEOLÓGICA - OYÓN,542.3750,,,
